,0
0,grate color cold wait dure famili time enjoy day weather
1,rememb girl world littl first lord love daughter prison time
2,go shirt would thing momma like didnt dont life could
3,lsdlocked0 lsdunhideused0 accent medium list grid light shade color ltrchfcs0
4,get life go home year time one homeless becaus got
5,home life god know told got prison year new son
6,homeless peopl like time get live one street us help
7,ltrchfcs0 right wrong littl actual last son near doe exist
8,man men shelter look street see fire morn black day
9,one said momma live like doctor want go life get
10,fear cold voic winter come wait make get see human
11,live stori fear help thing one ask hous church chang
12,truth offic homeless time one know anyon doctor cardboard go
13,year hope sell peopl 2017 next wish time homeless would
14,day life one today love time beauti get god better
15,though read momma everyon receiv understand ago ten dont didnt
16,god littl one rememb first tri hear go ask start
17,homeless address get street must one would like still sleep
18,go one day get dont said didnt told know im
19,thank tryon north street peopl speak kind magazin sell give
20,rememb stay summer play fear worri warm park know free
21,sidewalk love crack man day eye bag alon like line
22,thought away eye mani daughter first summer old hand basic
23,momma cold christma daddi doctor new want get wait broken
24,corner moment enjoy play breath allow usual daughter one anoth
25,time dont go day hope one get us friend love
26,shirt surviv shop right left bodi word store face end
27,homeless make first big hand may old open littl less
28,life momma go day homeless one doctor home famili time
29,veri less speak right move give alway thing new becaus
30,homeless shelter street live one look us person see upon
31,want help peopl could began life would eye give know
32,god go christma one becaus peopl love like street year
33,one work day time never thank look friend live hope
34,water day like feel peopl god said would made good
35,said job like told speak love sell gave zine help
36,peopl sell year homeless 2017 like hope would next wish
37,life didnt found allow could tryon experienc feel better hope
38,homeless peopl bill came like one us never dont someth
39,get hous peopl tri homeless street call job time day
40,get peopl like one day homeless live time street life
41,man julia day men shelter love walk sidewalk back see
42,dri warm rain public tryon bus stop shelter get cloth
43,homeless shelter us money usual may make street sidewalk life
44,lsdlocked0 lsdunhideused0 accent medium list grid light shade color ltrchfcs0
45,three day love daughter life pain addict much homeless live
46,go life get would got god year back told im
47,famili come time love friend bring right lord best peopl
48,food open hot could time knew hard bless cold breath
49,park bench felt alon allow becam themselv befor money never
